{
  "$schema": "https://json-schema.org/draft/2020-12/schema",
  "$id": "https://coretelligent.internal/onboarding/profile.schema.json",
  "title": "Client Lifecycle Profile",
  "description": "Declarative join/leave (and eventually move) definition for a single client. One file per client. The runbook becomes data; the per-system logic lives in shared modules; the orchestrator selects the lane via -Action.",
  "type": "object",
  "required": ["schemaVersion", "client", "identity", "secrets", "systems"],
  "additionalProperties": false,

  "properties": {
    "schemaVersion": { "const": "2.0" },

    "client": {
      "type": "object",
      "required": ["id", "name", "primaryDomain"],
      "additionalProperties": false,
      "properties": {
        "id":            { "type": "string", "pattern": "^[a-z0-9-]+$" },
        "name":          { "type": "string" },
        "primaryDomain": { "type": "string" },
        "domains":       { "type": "array", "items": { "type": "string" }, "description": "All routable domains, e.g. uovo.com / uovo.fashion / uovo.art." },
        "pod":           { "type": "string" }
      }
    },

    "identity": {
      "type": "object",
      "description": "Where the user truly lives. This one field drives most downstream behavior.",
      "required": ["backbone", "usernamePatterns"],
      "additionalProperties": false,
      "properties": {
        "backbone": {
          "enum": ["entra", "google", "ad-synced", "ad-standalone"],
          "description": "entra = cloud-only M365 is source of truth (Raith, BridgeInvest). google = Google Workspace primary, M365 mirrors it (Drive, Human Capital). ad-synced = on-prem AD syncs up to Entra via AD Connect (Six One, UOVO). ad-standalone = on-prem AD plus a SEPARATE, unsynced M365/Entra, both managed independently (Regal)."
        },
        "usernamePatterns": {
          "type": "array",
          "minItems": 1,
          "description": "Ordered; each tried until a unique one is found. Tokens: {first} {last} {firstInitial} {domain}.",
          "items": { "type": "string" }
        },
        "lowercase":   { "type": "boolean", "default": false },
        "domainRules": {
          "type": "array",
          "description": "Optional conditional domain/OU routing, e.g. uovo.fashion -> GardeRobe OU; Prialto users -> Prialto OU.",
          "items": {
            "type": "object",
            "additionalProperties": false,
            "properties": {
              "when":   { "type": "string", "description": "Case-variable condition, e.g. 'group == Prialto'." },
              "domain": { "type": "string" },
              "ou":     { "type": "string" }
            }
          }
        },
        "password": {
          "type": "object",
          "additionalProperties": false,
          "properties": {
            "mode":                  { "enum": ["generate", "shared-default"], "default": "generate", "description": "generate = unique per user; shared-default = a standing 'Default New User Password' pulled from a secret (Human Capital, UOVO)." },
            "sharedSecret":          { "type": "string", "description": "Secret key when mode = shared-default." },
            "minLength":             { "type": "integer", "minimum": 8, "default": 14 },
            "requireUpper":          { "type": "boolean", "default": true },
            "requireLower":          { "type": "boolean", "default": true },
            "requireNumber":         { "type": "boolean", "default": true },
            "requireSpecial":        { "type": "boolean", "default": true },
            "requireChangeAtSignIn": { "type": "boolean", "default": true },
            "onOffboard":            { "enum": ["reset", "reset-and-capture"], "default": "reset", "description": "reset-and-capture = reset then deliver the new password to the manager/delegate via secure email." }
          }
        },
        "directorySync": {
          "type": "object",
          "description": "Only for ad-synced backbones.",
          "additionalProperties": false,
          "properties": {
            "host":    { "type": "string" },
            "command": { "type": "string", "default": "Start-ADSyncSyncCycle -PolicyType Delta" }
          }
        }
      }
    },

    "secrets": {
      "type": "object",
      "minProperties": 1,
      "additionalProperties": { "$ref": "#/$defs/secretRef" }
    },

    "delivery": {
      "type": "object",
      "required": ["method"],
      "additionalProperties": false,
      "properties": {
        "method": { "enum": ["mimecast-secure-email", "manual", "none"] },
        "welcomeLetter": { "type": "boolean", "default": false },
        "note": { "type": "string" }
      }
    },

    "systems": {
      "type": "array",
      "minItems": 1,
      "items": { "$ref": "#/$defs/system" }
    }
  },

  "$defs": {
    "secretRef": {
      "type": "object",
      "required": ["provider", "id"],
      "additionalProperties": false,
      "properties": {
        "provider": { "enum": ["delinea"] },
        "id":       { "type": "string" },
        "label":    { "type": "string" }
      }
    },

    "when": {
      "enum": ["always", "on-request", "never"],
      "description": "always = every run; on-request = only if a case variable asks for it; never = system absent for this lifecycle action."
    },

    "lane": {
      "type": "object",
      "description": "Per-action behavior for one system. Omit the lane to mean 'never' for that action.",
      "additionalProperties": false,
      "properties": {
        "when":            { "$ref": "#/$defs/when", "default": "always" },
        "dependsOn":       { "type": "array", "items": { "type": "string" }, "description": "Lane-specific ordering. Overrides the system-level dependsOn for this action (e.g. Spanning runs last on offboard, after mailbox conversion and license removal)." },
        "requiresApproval":{ "type": "boolean", "default": false, "description": "Hard gate — e.g. no device wipe / no account delete without written POC approval." },
        "captureEvidence": { "type": "boolean", "default": false, "description": "Screenshot membership/app access and attach to the case before changing it. Common on offboard." },
        "schedule":        {
          "type": "object",
          "description": "Defer this step instead of running it now (e.g. archive after 30-90 days).",
          "additionalProperties": false,
          "properties": {
            "offsetDaysMin": { "type": "integer" },
            "offsetDaysMax": { "type": "integer" },
            "note":          { "type": "string" }
          }
        },
        "guardrails":      { "type": "array", "items": { "enum": ["do-not-delete", "do-not-move-ou", "no-device-wipe-without-approval"] }, "description": "Destructive-action protections that vary by client and are catastrophic to get wrong." },
        "config":          { "type": "object", "additionalProperties": true, "description": "System- and action-specific settings: license bundles, group lists, OU paths, mailbox thresholds, data-transfer targets, etc." }
      }
    },

    "system": {
      "type": "object",
      "required": ["key", "mode"],
      "additionalProperties": false,
      "properties": {
        "key": {
          "type": "string",
          "description": "Selects the module/handler. Known: servicenow, active-directory, directory-sync, m365, entra, exchange, google-workspace, mimecast, adobe, zoom, slack, 1password, spanning, perimeter81, tableau, notion, printix, egnyte, avd, workstation, welcome-letter, first-day-call, hardware, data-transfer, archive, equipment-return, case-resolution."
        },
        "mode":        { "enum": ["api", "browser", "manual"] },
        "secrets":     { "type": "array", "items": { "type": "string" }, "description": "One or more keys into the top-level secrets map (1Password needs login + security key)." },
        "dependsOn":   { "type": "array", "items": { "type": "string" }, "default": [] },
        "stopOnError": { "type": "boolean", "default": false },
        "onboard":     { "$ref": "#/$defs/lane" },
        "offboard":    { "$ref": "#/$defs/lane" }
      }
    }
  }
}
